ID,Masa,Salsa,Ingredientes,Estilo,Presentación,Maridaje,Extras,Tamaño,Precio
1,Fermentada,Yogur,"Jamón, Queso, Champiñones, Carne Picada, Cebolla",Cocina molecular,Personalizada,Cerveza,"Queso extra, Borde de queso, Aceite de oliva",Mediana,13.25
2,Integral,Yogur,"Jamón, Queso, Aceitunas, Carne Picada, Cebolla",Horno tradicional,Artística,Cerveza,"Queso extra, Salsa extra",Mediana,11.75
3,Integral,Carbonara,"Queso, Champiñones",Asado,Artística,Cerveza,"Queso extra, Salsa extra",Mediana,9.5
4,Integral,BBQ,"Jamón, Champiñones, Pimiento, Pepperoni, Albahaca, Aceitunas",Cocina a la leña,Clásica,Té,"Queso extra, Salsa extra",Mediana,12.5
5,Integral,Pesto,"Champiñones, Tomate, Pimiento, Aceitunas, Carne Picada, Cebolla",Cocina molecular,Clásica,Cóctel,"Salsa extra, Borde de queso",Mediana,12.56,Integral,Pesto,"Jamón, Queso, Champiñones",Cocina a la leña,Clásica,Cerveza,"Queso extra, Salsa extra",Mediana,10.25
